{
  "agentTaskId": "g002-taxonomy-pass2-independent",
  "anchors": [
    {
      "anchorId": "body-silhouette",
      "description": "Upright bulky body with four thick legs, rounded feet, and short tufted tail."
    },
    {
      "anchorId": "face-geometry",
      "description": "Rounded head with two large fan-shaped ears, wide eyes, and a long trunk curling toward the mouth."
    },
    {
      "anchorId": "signature-organ",
      "description": "Circular glowing orange instrument-like panel held against chest, with repeated thin line motifs on limbs."
    }
  ],
  "assignmentManifestSha256": "ca92e8238cc8113b5c0e232b6745f8b1e385a6511380d72216524c8fe772bec4",
  "blinded": true,
  "conductorHmacSha256": "35aa7287325b1b4ede71fd96e5278cc7b7a499afcaad1e6d56ce8e36e0bb2f81",
  "confidence": 0.96,
  "contractSha256": "f6d06316ba0ce315a79d3d784abe49f8f80463776ef07f5dbf5372185b9a8a15",
  "fresh": true,
  "inputAllowlistSha256": "06c2b46d72a6ea4a952f7aa5008ed1a959572a1d0f2ab4aa1d299e2e8f15876c",
  "inputAssetSha256s": [
    "d50888d8c1dc81e8b602541e3357b635e3c68455ad1d6c574d8941792d2db8eb",
    "1770be67b24e4bec95e0890efaea4e26afb0fc5a67e1b9bb6e190a53212105f2"
  ],
  "opaqueTaxonomyTargetId": "taxonomy-e28ebd5f1f7c720c1802edde",
  "outputSha256": "fa18a7cd3cce845d4e8070b28220acab4903c74c4a46ebfcefc9baea89b6c0c2",
  "packageManifestSha256": "74751ff2c2b36986b64a8845679f14826de4419a815fd334b5bb9b955992b7f9",
  "passNumber": 2,
  "promptSha256": "428e5d281d525d352776ae9950777265519d08f8bad67e50c2ed17b3f5c6e8d4",
  "publicSignature": {
    "algorithm": "Ed25519",
    "authorityFingerprint": "423f474c59667e5eabc13a703b8d7de4e97bcba33cdc22340873866db9d6a53f",
    "signatureBase64": "IOVAfr+w2ANm/75lLdMS+ELzZKl8NMfz/koHgeArHm0kzJluwTGWGhLdKgMHpEwhykYUNdT5wsugKVyOUqAtDg=="
  },
  "reviewId": "taxonomy-review-a042b58fb4ae48592665be7750fc3866",
  "reviewerInstanceId": "taxonomy-reviewer-pass2-independent",
  "reviewerRunAttestationSha256": "2e9f86919d8f4a21698d25da6762fd3b460c886f9f3d916110810215ab91c23d",
  "role": "primary",
  "schemaVersion": "g002-taxonomy-primary-vote-v1",
  "submittedAt": "2026-08-10T16:39:02.838Z",
  "taxonomy": {
    "biologicalClass": "mammal",
    "coreAnatomy": "quadruped",
    "locomotionPlan": "quadrupedal",
    "speciesFamily": "elephantidae"
  },
  "voterReviewRunId": "g002-taxonomy-run-pass2"
}
